{
  "schema_version": "d0-v1",
  "run_id": "RUN-fixture0001",
  "call_id": "CALL-fixture0001",
  "case_id": "CASE-fixture0001",
  "target_ref": {
    "schema_version": "target-ref-v1",
    "kind": "FILE",
    "observed": {
      "path": "C:\\samples\\fixture.exe"
    },
    "identity_strength": "PARTIAL",
    "verified_digest": {
      "algorithm": "sha256",
      "value": "aaaaaaaaaaaaaaaaaaaaaaaaaaaaaaaaaaaaaaaaaaaaaaaaaaaaaaaaaaaaaaaa"
    },
    "snapshot": {
      "size_bytes": 1024,
      "mtime_ns": 123456789
    },
    "revalidation_required": true
  },
  "tool_id": "static.ember_features",
  "tool_version": "0.1.0",
  "provider": {
    "id": "ember_local",
    "version": "0.1.0",
    "adapter": "ember_adapter",
    "runtime": "python"
  },
  "status": "SUCCESS",
  "observations": [
    {
      "facet": "ember_feature_count",
      "status": "SUCCESS",
      "coverage": "COMPLETE",
      "value": 2381,
      "limitations": [],
      "content_origin": "provider_output",
      "trust_level": "UNTRUSTED_CONTENT",
      "artifact_ref": null
    }
  ],
  "receipt_sha256": "3ab870ba9020be850e00adbd9ad3aeb08bd335b9aea219290950a0aba7c4cee8",
  "raw_artifacts": [],
  "error": null
}
